"id","shortname","name","party","active","education","birthdate","occupation","current_jobs","jobs","commissions","mandates","awards","url","scrape_date"
2,"Abílio Sousa e Silva","Abílio Sousa e Silva","PSD",False,"","1943-04-02","FUNCIONARIO PUBLICO","MEMBRO DO CONSELHO DE JURISDIÇAO","VEREADOR SUBSTITUTO; VOGAL; TECNICO SUPERIOR PRINCIPAL","","","","http://www.parlamento.pt/DeputadoGP/Paginas/Biografia.aspx?BID=2","2014-11-22T19:25:09.342575"
3,"Adão Silva","Adão José Fonseca Silva","PSD",True,"Licenciatura em Línguas e Literaturas Modernas - Estudos Portugueses e Franceses","1957-10-01","Professor","Deputado na XI Legislatura;; Presidente da Comissão Política Distrital do PSD-Bragança;","Director do Centro de Reabilitação Profissional de Macedo de Cavaleiros; Secretário de Estado Adjunto do Ministro do Saúde.; Deputado na  V, VI, VIII, IX e X Legislaturas; Presidente da Assembleia Municipal-Macedo de Cavaleiros; Professor efectivo no ensino secundário; Coordenador de Projectos de Intervenção Comunitária","Comissão de Saúde [Suplente]; Comissão de Segurança Social e Trabalho","","","http://www.parlamento.pt/DeputadoGP/Paginas/Biografia.aspx?BID=3","2014-11-22T19:25:09.503675"
4,"Adérito Campos","Adérito Manuel Soares Campos","PSD",False,"","1957-08-27","JURISTA","PRESIDENTE; DEPUTADO; DEPUTADO MUNICIPAL; PRESIDENTE","DEPUTADO - I, II, III, IV, E V LEGISLATURAS; DEPUTADO MUNICIPAL; VOGAL; PRESIDENTE; VOGAL; MEMBRO; MEMBRO; MEMBRO; MEMBRO; MEMBRO","","","","http://www.parlamento.pt/DeputadoGP/Paginas/Biografia.aspx?BID=4","2014-11-22T19:25:09.382857"
5,"Adriano Pinto","Adriano da Silva Pinto","PSD",False,"","1939-09-15","SOLICITADOR","MEMBRO; PRESIDENTE DA ASSEMBLEIA GERAL; PRESIDENTE; DEPUTADO; MEMBRO; PRESIDENTE DA COMISSAO POLITICA CONCELHIA; MEMBRO","VICE-PRESIDENTE; MEMBRO; PRESIDENTE; MEMBRO; PRESIDENTE; VICE-PRESIDENTE; PRESIDENTE; SECRETARIO ADJUNTO; PRESIDENTE; DEPUTADO - III, IV, E V LEGISLATURAS","","","PRESIDENTE HONORÁRIO DO RAMALDENSE F. CLUB; MEDALHA DE BONS SERVIÇOS DESPORTIVOS; CIDADÃO HONORÁRIO DA CIDADE DO PORTO; PRESIDENTE HONORÁRIO DA A.F. PORTO; SOCIO DE MÉRITO DA A.F. PORTO; SOCIO HONORÁRIO DO SPORT COMERCIO E SALGUEIROS; GALARDOADO ""DRAGÃO DE HONRA DO F.C. PORTO; MEDALHA DE OURO AO MÉRITO DA F. P. FUTEBOL","http://www.parlamento.pt/DeputadoGP/Paginas/Biografia.aspx?BID=5","2014-11-22T19:25:09.635047"
6,"Cerqueira de Oliveira","Alberto Cerqueira de Oliveira","PSD",False,"","1944-01-24","PROFESSOR DO ENSINO SECUNDARIO","VEREADOR; COORDENADOR DISTRITAL; VICE-PRESIDENTE; SECRETARIO NACIONAL; SECRETARIO COORDENADOR","DEPUTADO - V LEGISLATURA; PROFESSOR; DIRECTOR; COORDENADOR; COORDENADOR DISTRITAL","","","LOUVOR DA DIRECÇÃO-GERAL DE EDUCAÇÃO DE ADULTOS","http://www.parlamento.pt/DeputadoGP/Paginas/Biografia.aspx?BID=6","2014-11-22T19:25:09.780737"
7,"Alberto Araujo","Alberto Monteiro de Araújo","PSD",False,"","1951-03-19","PERITO DE FISCALIZAÇÃO TRIBUTÁRIA DA D.G.C.I.","PRESIDENTE; LIDER; VICE-SECRETARIO; MEMBRO","PRESIDENTE; PRESIDENTE; VEREADOR; VICE-PRESIDENTE; PRESIDENTE; PRESIDENTE; DEPUTADO - IV E V LEGISLATURAS; SECRETARIO; PRESIDENTE; SECRETARIO; MEMBRO; MEMBRO; MEMBRO; COORDENADOR; MEMBRO; MEMBRO","","","UMA NO ULTRAMAR","http://www.parlamento.pt/DeputadoGP/Paginas/Biografia.aspx?BID=7","2014-11-22T19:25:09.928254"
8,"Álvaro Viegas","Álvaro Jose Martins Viegas","PSD",False,"","1963-08-13","JURISTA","MEMBRO; PRESIDENTE; VICE-PRESIDENTE","DEPUTADO - V LEGISLATURA; PRESIDENTE; COLABORADOR; MEMBRO; PRESIDENTE; VOGAL; MEMBRO; COLABORADOR; PRESIDENTE","","","","http://www.parlamento.pt/DeputadoGP/Paginas/Biografia.aspx?BID=8","2014-11-22T19:25:09.377820"
9,"Álvaro Barreto","Álvaro Roque de Pinho Bissaia Barreto","PSD",False,"","1936-01-01","GESTOR DE EMPRESAS","PRESIDENTE DO CONSELHO DE ADMINISTRAÇAO; VICE-PRESIDENTE DO CONSELHO DE ADMINISTRAÇAO; ADMINISTRADOR","DEPUTADO - II LEGISLATURA; MINISTRO; MINISTRO; MINISTRO; MINISTRO; MINISTRO; DEPUTADO -IV E V LEGISLATURAS","","","COMENDADOR DA ORDEM DE MÉRITO INDUSTRIAL-PORTUGAL; GRANDE CRUZ DA ORDEM DO FALCÃO - ISLANDIA; GRANDE CRUZ DA ORDEM DE LEOPOLDO II- BELGICA; CAVALEIRO DA GRAM CRUZ- ITALIA; CRUZ DE STº OLAVO - NORUEGA","http://www.parlamento.pt/DeputadoGP/Paginas/Biografia.aspx?BID=9","2014-11-22T19:25:09.627264"
